{
  "$schema": "https://json-schema.org/draft/2020-12/schema",
  "$id": "https://jmo.local/schemas/common_finding.v1.json",
  "title": "CommonFinding",
  "type": "object",
  "required": [
    "schemaVersion",
    "id",
    "ruleId",
    "severity",
    "tool",
    "location",
    "message"
  ],
  "properties": {
    "schemaVersion": { "type": "string", "enum": ["1.0.0", "1.1.0", "1.2.0"] },
    "id": { "type": "string", "minLength": 1, "description": "Deterministic fingerprint. Must be non-empty: phase-1 deduplication silently DROPS any finding with a falsy id (#848)" },
    "ruleId": { "type": "string", "minLength": 1 },
    "title": { "type": "string" },
    "message": { "type": "string", "minLength": 1 },
    "description": { "type": "string" },
    "severity": { "type": "string", "enum": ["CRITICAL", "HIGH", "MEDIUM", "LOW", "INFO"] },
    "cvss": {
      "type": "object",
      "description": "Best available CVSS score. Adapters select v3.x over v4.0 over v2.0, whatever the numbers, and keep the vector, so the score stays auditable (#1356). Omitted entirely when the tool reports no score -- Finding.to_dict() drops None, so this is never null.",
      "required": ["score"],
      "properties": {
        "version": { "type": "string", "description": "CVSS revision, e.g. \"3.x\", \"4.0\" or \"2.0\"" },
        "score": { "type": "number", "minimum": 0, "maximum": 10, "description": "Base score" },
        "vector": { "type": "string", "description": "Base vector string, e.g. \"AV:N/AC:L/PR:N/UI:N/S:U/C:H/I:H/A:H\"" }
      }
    },
    "tool": {
      "type": "object",
      "required": ["name", "version"],
      "properties": {
        "name": { "type": "string" },
        "version": { "type": "string" }
      }
    },
    "location": {
      "type": "object",
      "required": ["path"],
      "properties": {
        "path": { "type": "string" },
        "startLine": { "type": "integer", "minimum": 0 },
        "endLine": { "type": "integer", "minimum": 0 }
      }
    },
    "remediation": {
      "oneOf": [
        { "type": "string" },
        {
          "type": "object",
          "properties": {
            "summary": { "type": "string", "description": "Brief remediation description" },
            "fix": { "type": "string", "description": "Suggested code fix (e.g., from Semgrep autofix)" },
            "steps": { "type": "array", "items": { "type": "string" }, "description": "Step-by-step remediation instructions" },
            "references": { "type": "array", "items": { "type": "string", "format": "uri" }, "description": "Links to remediation guides" }
          }
        }
      ]
    },
    "references": { "type": "array", "items": { "type": "string", "format": "uri" } },
    "tags": { "type": "array", "items": { "type": "string" } },
    "context": {
      "type": "object",
      "description": "Code context for the finding (v1.1.0)",
      "properties": {
        "snippet": { "type": "string", "description": "2-5 line code snippet around the finding" },
        "startLine": { "type": "integer", "minimum": 0, "description": "First line of snippet" },
        "endLine": { "type": "integer", "minimum": 0, "description": "Last line of snippet" },
        "language": { "type": "string", "description": "Programming language for syntax highlighting" }
      }
    },
    "risk": {
      "type": "object",
      "description": "Risk metadata (v1.1.0)",
      "properties": {
        "cwe": { "type": "array", "items": { "type": "string" }, "description": "CWE IDs (e.g., ['CWE-269'])" },
        "owasp": { "type": "array", "items": { "type": "string" }, "description": "OWASP categories (e.g., ['A04:2021'])" },
        "nist": {
          "type": "object",
          "description": "NIST framework mappings",
          "properties": {
            "sp80053": { "type": "array", "items": { "type": "string" }, "description": "NIST SP 800-53 controls (e.g., ['AC-6', 'IA-5'])" },
            "csf": { "type": "array", "items": { "type": "string" }, "description": "NIST Cybersecurity Framework (e.g., ['PR.AC-1', 'DE.CM-1'])" },
            "ssdf": { "type": "array", "items": { "type": "string" }, "description": "NIST SSDF practices (e.g., ['PW.8.2'])" }
          }
        },
        "confidence": { "type": "string", "enum": ["HIGH", "MEDIUM", "LOW"], "description": "Confidence level of finding" },
        "likelihood": { "type": "string", "enum": ["HIGH", "MEDIUM", "LOW"], "description": "Likelihood of exploitation" },
        "impact": { "type": "string", "enum": ["HIGH", "MEDIUM", "LOW"], "description": "Impact if exploited" }
      }
    },
    "compliance": {
      "type": "object",
      "description": "Compliance framework mappings (v1.2.0)",
      "properties": {
        "owaspTop10_2021": {
          "type": "array",
          "items": { "type": "string" },
          "description": "OWASP Top 10 2021 categories (e.g., ['A02:2021', 'A06:2021'])"
        },
        "cweTop25_2024": {
          "type": "array",
          "items": {
            "type": "object",
            "properties": {
              "id": { "type": "string", "description": "CWE ID (e.g., 'CWE-79')" },
              "rank": { "type": "integer", "minimum": 1, "maximum": 25, "description": "CWE Top 25 rank" },
              "category": { "type": "string", "description": "Category (e.g., 'Injection', 'Cryptographic Issues')" }
            }
          },
          "description": "CWE Top 25 2024 Most Dangerous Weaknesses with rank"
        },
        "cisControlsV8_1": {
          "type": "array",
          "items": {
            "type": "object",
            "properties": {
              "control": { "type": "string", "description": "CIS Control ID (e.g., '16.7')" },
              "title": { "type": "string", "description": "Control title" },
              "implementationGroup": { "type": "string", "enum": ["IG1", "IG2", "IG3"], "description": "Implementation Group" }
            }
          },
          "description": "CIS Controls v8.1 mappings with Implementation Group"
        },
        "nistCsf2_0": {
          "type": "array",
          "items": {
            "type": "object",
            "properties": {
              "function": { "type": "string", "enum": ["GOVERN", "IDENTIFY", "PROTECT", "DETECT", "RESPOND", "RECOVER"], "description": "CSF Function" },
              "category": { "type": "string", "description": "Category ID (e.g., 'GV.SC', 'PR.DS')" },
              "subcategory": { "type": "string", "description": "Subcategory ID (e.g., 'PR.DS-1')" },
              "description": { "type": "string", "description": "Subcategory description" }
            }
          },
          "description": "NIST Cybersecurity Framework 2.0 mappings"
        },
        "pciDss4_0": {
          "type": "array",
          "items": {
            "type": "object",
            "properties": {
              "requirement": { "type": "string", "description": "PCI DSS 4.0 requirement (e.g., '6.2.4')" },
              "description": { "type": "string", "description": "Requirement description" },
              "priority": { "type": "string", "enum": ["CRITICAL", "HIGH", "MEDIUM"], "description": "Compliance priority" }
            }
          },
          "description": "PCI DSS 4.0 requirement mappings"
        },
        "mitreAttack": {
          "type": "array",
          "items": {
            "type": "object",
            "properties": {
              "tactic": { "type": "string", "description": "ATT&CK Tactic (e.g., 'Initial Access', 'Execution')" },
              "technique": { "type": "string", "description": "Technique ID (e.g., 'T1190', 'T1552')" },
              "techniqueName": { "type": "string", "description": "Technique name (e.g., 'Exploit Public-Facing Application')" },
              "subtechnique": { "type": "string", "description": "Subtechnique ID (e.g., 'T1552.001')" },
              "subtechniqueName": { "type": "string", "description": "Subtechnique name (e.g., 'Credentials in Files')" }
            }
          },
          "description": "MITRE ATT&CK technique mappings"
        }
      }
    },
    "secretContext": {
      "type": "object",
      "description": "Secret-specific context (v1.1.0)",
      "properties": {
        "type": { "type": "string", "description": "Secret type (e.g., 'generic-api-key')" },
        "secret": { "type": "string", "description": "The detected secret value" },
        "entropy": { "type": "number", "description": "Shannon entropy score" },
        "commit": { "type": "string", "description": "Git commit hash" },
        "author": { "type": "string", "description": "Git commit author" },
        "date": { "type": "string", "format": "date-time", "description": "Git commit date (ISO 8601)" },
        "gitUrl": { "type": "string", "format": "uri", "description": "Link to view in Git hosting (GitHub, GitLab, etc.)" }
      }
    },
    "dependency": {
      "type": "object",
      "description": "Dependency scanners (trivy, osv-scanner, grype): the vulnerable installed package. With the lockfile (location.path) and the advisory (ruleId plus aliases) it is the finding's identity: one vulnerability in one installed package version is one finding, whichever and however many tools report it (#1346).",
      "required": ["name", "version"],
      "properties": {
        "name": { "type": "string", "minLength": 1, "description": "Package name as the tool spells it (e.g., 'lodash', '@scope/pkg', 'Flask_Cors')" },
        "version": { "type": "string", "minLength": 1, "description": "Installed version as the tool spells it (e.g., '4.17.4', 'v0.3.0')" },
        "ecosystem": { "type": "string", "description": "PURL type when the tool reports a PURL (e.g., 'npm', 'pypi', 'golang'); absent otherwise" },
        "aliases": { "type": "array", "items": { "type": "string" }, "description": "Other ids the tool gives the same advisory (e.g., the GHSA of a CVE). An adapter never lists the finding's own ruleId; a consensus finding holds the union of its members' aliases" }
      }
    },
    "target": {
      "type": "object",
      "description": "The scan target the finding came from, set by the report phase and not by an adapter: the kind of target from its results folder (individual-repos is 'repo'), and the name of the folder it was scanned into. A finding's id is derived from the adapter's id and this, so the same finding in two targets of one scan is two findings, and renaming a checkout changes every id in it (#1309). location.path stays relative to the target.",
      "required": ["type", "name"],
      "properties": {
        "type": { "type": "string", "enum": ["repo", "image", "iac", "url", "gitlab", "k8s"], "description": "Kind of target, as 'jmo scan' names it" },
        "name": { "type": "string", "minLength": 1, "description": "Name of the target's results folder (e.g., the repository's directory name)" }
      }
    },
    "raw": { "type": "object" }
  },
  "additionalProperties": true
}
